Hospital Name,Location,Rating,Review Count,review
City Hospital,New York,4.5,150,Excellent service and friendly staff. Highly recommended!
Green Valley Clinic,San Francisco,4.0,120,Great doctors but long waiting times.
Sunrise Hospital,Los Angeles,3.5,95,Good facilities but room cleanliness could be better.
Metro Care Center,Chicago,4.2,200,"Professional and courteous staff, very satisfied with my visit."
Healthy Living Hospital,Miami,4.7,80,Top-notch healthcare with a very personal touch.
